policy_id,policy,name,policy_description
1,life,Life Insurance refers to a policy or cover whereby the policyholder can ensure financial freedom for his/her family members after death
3,vehicle,Vehicle insurance refers to policies that offer financial assistance in the event of accidents involving your car or bike.
4,property,"Any building or immovable structure can be insured through property insurance plans. This can be either your residence or commercial space. If any damage befalls such a property, you can claim financial assistance from the insurance provider."
5,travel,"When talking about the different types of insurance policies, one must not forget to learn more about travel insurance plans."
6,health,"Health insurance refers to a type of general insurance, which provides financial assistance to policyholders when they are admitted to hospitals for treatment."
